{
  "module_name": "cmd_queue",
  "file": "cmd_queue.sv",
  "phase": 3,
  "agent": "cmd_queue_agent",
  "dependencies": [
    "addr_decoder",
    "wb_port"
  ],
  "spec_version": "2.0.0",
  "parameters": {
    "DEPTH": 16,
    "IDX_BITS": 4,
    "ROW_BITS": 15,
    "COL_BITS": 10,
    "BANK_BITS": 3,
    "AUX_WIDTH": 4,
    "DATA_WIDTH": 32,
    "ENTRY_W": 33
  },
  "ports": {
    "clock_reset": [
      {
        "name": "clk",
        "width": 1,
        "dir": "input"
      },
      {
        "name": "rst_n",
        "width": 1,
        "dir": "input"
      }
    ],
    "enqueue": [
      {
        "name": "enq_valid",
        "width": 1,
        "dir": "input"
      },
      {
        "name": "enq_ready",
        "width": 1,
        "dir": "output"
      },
      {
        "name": "enq_row",
        "width": 15,
        "dir": "input",
        "source": "addr_decoder.dec_row"
      },
      {
        "name": "enq_col",
        "width": 10,
        "dir": "input",
        "source": "addr_decoder.dec_col"
      },
      {
        "name": "enq_bank",
        "width": 3,
        "dir": "input",
        "source": "addr_decoder.dec_bank"
      },
      {
        "name": "enq_we",
        "width": 1,
        "dir": "input",
        "source": "wb_port.req_we"
      },
      {
        "name": "enq_aux",
        "width": 4,
        "dir": "input"
      }
    ],
    "dequeue": [
      {
        "name": "deq_grant",
        "width": 1,
        "dir": "input"
      },
      {
        "name": "deq_idx",
        "width": 4,
        "dir": "input"
      }
    ],
    "lookahead": [
      {
        "name": "entry_valid",
        "width": 16,
        "dir": "output"
      },
      {
        "name": "entry_row",
        "width": "16x15",
        "dir": "output"
      },
      {
        "name": "entry_col",
        "width": "16x10",
        "dir": "output"
      },
      {
        "name": "entry_bank",
        "width": "16x3",
        "dir": "output"
      },
      {
        "name": "entry_we",
        "width": "16x1",
        "dir": "output"
      },
      {
        "name": "entry_aux",
        "width": "16x4",
        "dir": "output"
      }
    ],
    "status": [
      {
        "name": "queue_full",
        "width": 1,
        "dir": "output"
      },
      {
        "name": "queue_empty",
        "width": 1,
        "dir": "output"
      },
      {
        "name": "queue_count",
        "width": 5,
        "dir": "output"
      }
    ]
  }
}